<?xml version="1.0" encoding="UTF-8" ?>
<!DOCTYPE item SYSTEM "../dtd/item.dtd">

<item type="prop">

    <beh>
        <ID>item</ID>
        <name>物品</name>
        <tab>tab</tab>
        <maxSize>32</maxSize>
        <foil>false</foil>
        <isCreateModeShow>true</isCreateModeShow>
    </beh>

    <res>
        <textures>None</textures>
    </res>

</item>